Truth,Decoded
Salve quanto costa quell articolo,e e lo lo si e io
E in offerta costa dieci euro,reore e certo
Tutto bene grazie,un e stai
Prendiamo un caffe al bar,e a a e lo
"Certo volentieri, io lo prendero macchiato",e io io si e costa
A che ora arriva il pullman,pretra al lmuae
Dovrebbe arrivare tra qualche minuto,e rire arara le tutto
Quanto costa il biglietto,un e lo io breato
Purtroppo non lo so pero potresti chiedere all autista,prego lo lo lo e orerierirelutia
Va bene grazie lo stesso,un lo bene e rireso
Prego,pero
Perfetto vorrei comprarne due.,prego ora lo
Certo ecco a lei vuole un sacchetto,e a a a e e certo
Si grazie e arrivederci,e e e ariseata
Le auguro una buona giornata,e e a e a un io minuto
Buongiorno io sono Mario,lo mario
Buonasera io sono Mario,un io io mario
Piacere Luigi come stai,preori a e
Tutto bene tu,un lo bene
